{
  "qualification_version": "1.0.0",
  "provider_id": "PRV_SPORTMONKS",
  "provider_name": "Sportmonks",
  "checked_at": "2026-09-21",
  "evidence_bundle": "evidence/source-qualification/sportmonks.evidence.json",
  "official_domains": [
    "sportmonks.com"
  ],
  "technical_matrix": {
    "football_coverage": "VERIFIED",
    "epl_coverage": "VERIFIED",
    "operator_level_prices": "VERIFIED",
    "multi_operator_coverage": "VERIFIED",
    "stable_event_identifier": "VERIFIED",
    "operator_identifier_or_stable_label": "VERIFIED",
    "market_identifier_or_stable_key": "VERIFIED",
    "outcome_identifier_or_label": "VERIFIED",
    "source_observed_timestamp": "VERIFIED",
    "historical_odds_access": "VERIFIED",
    "documented_rate_limits": "NOT_VERIFIED"
  },
  "rights_matrix": {
    "ingest_use": "ALLOWED",
    "cache": "ALLOWED",
    "retain_historical": "ALLOWED",
    "derive_calculations": "ALLOWED",
    "public_display": "UNKNOWN",
    "redistribute_raw": "UNKNOWN",
    "redistribute_derived": "UNKNOWN"
  },
  "attribution_requirement": "Attribution required for logos and profile photos to their owners; no general attribution clause for the odds data itself.",
  "geographic_restrictions": null,
  "pricing_access": "PUBLIC_PLAN",
  "capabilities": {
    "CURRENT_PRICE_OBSERVATION": {
      "outcome": "QUALIFIED",
      "evidence_ids": [
        "sm-football-coverage",
        "sm-epl-coverage",
        "sm-operator-level",
        "sm-event-id",
        "sm-operator-id",
        "sm-market-key",
        "sm-outcome-label",
        "sm-ingest-use"
      ],
      "notes": "Operator-level EPL prices with event/market/outcome identity and ingest rights."
    },
    "PUBLIC_SPOTBOARD": {
      "outcome": "UNRESOLVED",
      "evidence_ids": [],
      "notes": "Multiple operators available, but public display of the odds data is not established by the public Terms; failed closed."
    },
    "DERIVED_PROBABILITY_DISPLAY": {
      "outcome": "UNRESOLVED",
      "evidence_ids": [
        "sm-derive"
      ],
      "notes": "Deriving permitted, but public display of derived output is gated on the unresolved public_display posture; failed closed."
    },
    "SOURCE_TIME_MARKET_MOVEMENT": {
      "outcome": "QUALIFIED",
      "evidence_ids": [
        "sm-operator-level",
        "sm-operator-id",
        "sm-source-time",
        "sm-event-id",
        "sm-market-key",
        "sm-outcome-label",
        "sm-ingest-use",
        "sm-retain"
      ],
      "notes": "Per-bookmaker update timestamp plus retention rights support internal source-time movement analysis."
    },
    "HISTORICAL_DATASET_RETENTION": {
      "outcome": "QUALIFIED",
      "evidence_ids": [
        "sm-ingest-use",
        "sm-retain"
      ],
      "notes": "Storage of pulled data is permitted. Provider's own history window is limited (~7 days post kick-off)."
    },
    "RAW_DATA_REDISTRIBUTION": {
      "outcome": "UNRESOLVED",
      "evidence_ids": [
        "sm-resale-restriction"
      ],
      "notes": "Broad raw redistribution right not established (only resale-without-approval is clearly prohibited); UNRESOLVED, fail closed."
    }
  },
  "blockers": [
    "Public display of the odds data is not explicitly established by the public Terms (public_display = UNKNOWN), which blocks PUBLIC_SPOTBOARD and derived public display until clarified.",
    "Broad raw redistribution is not established either way by the public Terms: distribution/transfer/storage are allowed while reselling the data as data without approval is prohibited; the broad redistribute_raw right is recorded UNKNOWN (fail closed)."
  ],
  "unresolved_questions": [
    "Do the Terms permit public display of the odds data in a user-facing website/app? Not explicitly established; recorded UNKNOWN.",
    "Does the broad redistribute_raw right apply, given the Terms allow distribution/transfer while prohibiting resale of the data as data? Recorded UNKNOWN pending clarification.",
    "What are the documented API rate limits per plan for the odds feed? Not retrieved (documented_rate_limits = NOT_VERIFIED).",
    "The Terms page did not display an effective/last-updated date; revalidate before production use."
  ],
  "evidence_ids": [
    "sm-football-coverage",
    "sm-epl-coverage",
    "sm-operator-level",
    "sm-multi-operator",
    "sm-operator-id",
    "sm-event-id",
    "sm-market-key",
    "sm-outcome-label",
    "sm-source-time",
    "sm-historical",
    "sm-ingest-use",
    "sm-cache",
    "sm-retain",
    "sm-derive",
    "sm-resale-restriction"
  ]
}
